{
  "$schema": "https://json-schema.org/draft/2020-12/schema",
  "title": "Fridolin brain.json",
  "description": "A brain's manifest, version 1, in the brain's own folder, as docs/BRAINS.md describes it; config.json's brain_dirs[].approved holds the copy you approved. Fields are added without a new version; one renamed, removed or given another meaning comes with one.",
  "type": "object",
  "additionalProperties": false,
  "required": ["id", "name"],
  "properties": {
    "version": {"const": 1, "description": "The version of the manifest; absent is 1."},
    "id": {"type": "string", "pattern": "^[a-z0-9][a-z0-9_-]{0,39}$", "description": "Stable: history, the sandbox profile and credential files go by it."},
    "name": {"type": "string", "pattern": "\\S", "description": "The name the dashboard shows."},
    "routing": {
      "type": "object",
      "additionalProperties": false,
      "properties": {
        "handles_dms": {"type": "boolean"},
        "default": {"type": "boolean"},
        "groups": {"type": ["array", "null"], "items": {"type": "string", "pattern": "@g\\.us$"}},
        "answer_files": {"type": "boolean", "description": "Default true."},
        "answer_forwards": {"type": "boolean", "description": "Default true."}
      }
    },
    "model": {"type": "string"},
    "effort": {"enum": ["", "low", "medium", "high", "xhigh", "max"]},
    "disallowed_tools": {"type": "array", "items": {"type": "string"}, "description": "Left out, the brain gets the global list; [] allows every tool."},
    "prompt_file": {"type": "string", "not": {"pattern": "^(/|\\.\\.)"}, "description": "Relative to the brain's folder, and inside it. Default brain-prompt.md."},
    "reply_chat": {"type": "string"},
    "observe": {"enum": ["", "history", "run"]},
    "approvals": {"enum": ["", "ask", "auto"], "description": "ask (the default): request_approval puts a poll in your chat and waits for your vote. auto: it answers approved at once, recorded as approved by \"auto\"; lockdown, the run's risk budget, policy.max_pending_irreversible and observe-only runs still hold. A security trade-off: the brain then takes irreversible steps without your yes."},
    "live_session": {"enum": ["", "off", "owner_dm"], "description": "off (the default): every message runs claude -p. owner_dm: the brain keeps one Claude Code session running, started with --dangerously-load-development-channels, and wakes it with the messages you write in a direct chat; any other message, and any the session cannot take, runs claude -p as before. Needs dangerously_skip_permissions and not inherit_claude_user_config (docs/BRAINS.md, Live session)."},
    "backup": {
      "type": "object",
      "additionalProperties": false,
      "properties": {
        "enabled": {"type": "boolean"},
        "exclude": {"type": ["array", "null"], "items": {"type": "string", "not": {"pattern": "[\\r\\n]|^\\s*\\+"}}},
        "targets": {"type": ["object", "null"], "description": "Which backup targets get the folder: \"cloud\" (unset: true) and \"node:<target>\" of vault.targets (unset: false).", "propertyNames": {"pattern": "^(cloud|node:[a-z0-9][a-z0-9-]{0,31})$"}, "additionalProperties": {"type": "boolean"}},
        "node_only": {"type": ["array", "null"], "description": "Paths, in exclude's syntax, that never go to the cloud but go to the node targets the brain chooses.", "items": {"type": "string", "pattern": "\\S", "not": {"pattern": "[\\r\\n]|^\\s*\\+"}}}
      }
    },
    "calendar": {
      "type": "object",
      "additionalProperties": false,
      "properties": {
        "account": {"$ref": "#/$defs/calendar_id"},
        "calendars": {"type": ["array", "null"], "items": {"$ref": "#/$defs/calendar_id"}},
        "default": {"$ref": "#/$defs/calendar_id"}
      }
    },
    "role": {"enum": ["", "core"], "description": "\"core\" for the one brain that may reach the others through its grants; left out for a sub-brain."},
    "grants": {
      "type": ["object", "null"],
      "description": "Only on the core brain: what it may do with each other brain, by that brain's id. The brain must be configured and not the core brain itself.",
      "propertyNames": {"pattern": "^[a-z0-9][a-z0-9_-]{0,39}$"},
      "additionalProperties": {"type": ["array", "null"], "items": {"enum": ["delegate", "files", "read"]}}
    },
    "memory": {
      "type": "object",
      "additionalProperties": false,
      "description": "The memory index (docs/BRAINS.md, Memory). Left out: nothing recalled, no consolidation.",
      "properties": {
        "inject": {"type": "boolean", "description": "Put the owner's messages and the brain's own notes that match a new message into its prompt, with their sources. Default false."},
        "top_k": {"type": "integer", "minimum": 0, "maximum": 20, "description": "The most chunks a prompt gets; 0 is the default, 5."},
        "max_chars": {"type": "integer", "minimum": 0, "maximum": 20000, "description": "The most characters of them in all; 0 is the default, 2000."},
        "consolidate": {"type": "string", "pattern": "^$|^\\s*(([Ww][Ee][Ee][Kk][Ll][Yy]\\s+)?[A-Za-z]{3,9}|[Dd][Aa][Ii][Ll][Yy])\\s+[0-9]{1,2}:[0-9]{2}\\s*$", "description": "When the brain runs skills/memory-consolidation.md: \"weekly sun 18:00\" or \"daily 07:00\", in the bridge's time zone; empty never."}
      }
    },
    "files": {
      "type": "object",
      "additionalProperties": false,
      "description": "How the Files page and the site take uploads into the brain's folder (docs/FILES.md, Uploads).",
      "properties": {
        "uploads": {
          "type": ["array", "null"],
          "description": "The folders, with their subfolders, that take uploads from the site roles allowed to upload to this brain. You upload anywhere from the dashboard.",
          "items": {
            "type": "object",
            "additionalProperties": false,
            "required": ["folder"],
            "properties": {
              "folder": {"type": "string", "maxLength": 200, "pattern": "^[^./\\\\][^/\\\\]*(/[^./\\\\][^/\\\\]*)*$", "description": "Relative to the brain folder, with / between names, none starting with a dot."},
              "to_brain": {"type": "boolean", "description": "Hand an upload to the brain, as a file sent on WhatsApp, instead of leaving it in the folder. Default false."}
            }
          }
        }
      }
    },
    "github": {
      "type": "object",
      "additionalProperties": false,
      "required": ["repos", "permissions"],
      "description": "The GitHub access of the runs that answer the owner (direct messages and Plaud voice questions), never a group's, a hand-off's or a delegated task's: a token for these repositories and permissions, as gh's login, minted as a run starts and ended with it (docs/BRAINS.md, GitHub in your chats).",
      "properties": {
        "repos": {
          "type": ["array", "null"],
          "minItems": 1,
          "maxItems": 20,
          "items": {
            "type": "string",
            "pattern": "^[A-Za-z0-9-]{1,39}/[A-Za-z0-9._-]{1,100}$"
          },
          "description": "Repositories, as owner/name."
        },
        "permissions": {
          "type": ["object", "null"],
          "additionalProperties": {
            "enum": ["read", "write"]
          },
          "propertyNames": {
            "pattern": "^[a-z][a-z_]{1,39}$"
          },
          "description": "GitHub permissions by name: {\"issues\": \"write\", \"contents\": \"read\"}."
        }
      }
    },
    "schedules": {
      "type": "array",
      "maxItems": 50,
      "description": "Compat: the brain's scheduled agents as brain.json held them before .brain (docs/BRAINS.md, Scheduled agents). The bridge moves them into .brain/schedules/<name>.json, one file each, and reads them here meanwhile. Each needs its name here.",
      "items": {"$ref": "schedule.schema.json"}
    }
  },
  "$defs": {
    "calendar_id": {"type": "string", "not": {"pattern": "[\\r\\n,]"}}
  }
}
