{
  "version": 1,
  "id": "family",
  "name": "Family",
  "routing": {
    "handles_dms": false,
    "default": false,
    "groups": ["120363000000000000@g.us"]
  },
  "model": "",
  "effort": "medium",
  "prompt_file": "brain-prompt.md",
  "reply_chat": "",
  "backup": {
    "enabled": true,
    "exclude": ["node_modules/", "*.log", ".DS_Store", ".venv/", "__pycache__/"]
  }
}
